resultados/tablas/calibracion_prob_compra.csv

intervalo,clientes,probabilidad_media,frecuencia_real
"(-0.001, 0.1]",46,0.05506455191994991,0.41304347826086957
"(0.1, 0.2]",1581,0.1597846981858588,0.14864010120177104
"(0.2, 0.3]",130,0.2487410463776726,0.4076923076923077
"(0.3, 0.4]",158,0.3526613985312569,0.43670886075949367
"(0.4, 0.5]",137,0.44309299922458567,0.5401459854014599
"(0.5, 0.6]",74,0.5529779803457312,0.6351351351351351
"(0.6, 0.7]",98,0.6419271496604666,0.7244897959183674
"(0.7, 0.8]",54,0.7512857090411755,0.8703703703703703
"(0.8, 0.9]",60,0.8500645546904316,0.85
"(0.9, 1.0]",19,0.9325779961434706,0.9473684210526315

documentos/evaluacion_prob_compra.md

### 6.2. Interpretación

Por ejemplo, entre 0.2 y 0.3, la probabilidad media estimada fue de 24.87 %, mientras que la frecuencia observada fue de 40.77 %.

En cambio, entre 0.8 y 0.9, la probabilidad estimada fue de 85.01 % y la frecuencia real fue de 85.00 %, lo que representa una coincidencia prácticamente exacta.

El primer intervalo presentó una desviación considerable: una probabilidad media estimada de 5.51 % frente a una frecuencia real de 41.30 %.